{
      "Name": "Ancillary Monitor Corpus: Common Crawl - German Web",
      "URL": "http://hdl.handle.net/11372/LRT-5811",
	"Family": "Computer-mediated communication corpora",
      "Description": "This is a continuously updated corpus of the German-language internet, with a new release published every year.\nThe corpus currently covers the years 2013-2024.\nThe corpus is based on data dumps from <a href=\"https://commoncrawl.org/\">CommonCrawl</a>.\n The filtering and subsequent processing was carried out using <a href=\"http://hdl.handle.net/11234/1-2634\">CorpusExplorer</a> with additional supplementary scripts, and <a href=\"http://hdl.handle.net/11372/LRT-323\">TreeTagger</a> was used for the automatic annotation.\nThe corpus is available for download from LINDAT.",
      "Language": ["deu"],
      "Licence": "CC BY-NC-SA 4.0",
      "Size": ["12,743,367 texts", "14,360,469,888 tokens"],
      "Annotation": ["tokenised", "sentence tagging", "PoS-tagged", "lemmatised"],
      "Infrastructure": "CLARIN",
      "Access": {
	"Download": "http://hdl.handle.net/11372/LRT-5811"
	},
      "Publication":""
}