{
      "Name": "1000PLUS Novels Corpus (1.0)",
      "URL": "http://hdl.handle.net/11321/699",
	"Family": "Literary corpora",
      "Description": "This corpus is available for download from CLARIN-PL.",
      "Language": ["pol"],
      "Licence": "CC BY-SA 3.0",
      "Size": ["1000 texts", "17,352,826 words"],
      "Annotation": [],
      "Infrastructure": "CLARIN",
      "Access": {
	"Download": "http://hdl.handle.net/11321/699"
	},
      "Publication": ""
}
