{
      "Name": "August Strindberg's novels (2017-10-16)",
      "URL": "http://hdl.handle.net/10794/79",
	"Family": "Literary corpora",
      "Description": "This corpus presents the collected works of August Strindberg.\nThe corpus is available for download from SWE-CLARIN and for online browsing through Korp.",
      "Language": ["swe"],
      "Licence": "CC BY 4.0",
      "Size": ["4,309,037 tokens", "321,759 sentences"],
      "Annotation": ["sentence scrambling"],
      "Infrastructure": "CLARIN",
      "Access": {
	"Browse": "https://spraakbanken.gu.se/korp/#?corpus=strindbergromaner",
	"Download": "http://hdl.handle.net/10794/79"
	},
      "Publication": ""
}
