{
      "Name": "Complete Corpus of Anglo-Saxon Poetry",
      "URL": "http://hdl.handle.net/11372/LRT-867",
	"Family": "Literary corpora",
      "Description": "This corpus is available for online browsing through an external interface.",
      "Language": ["ang"],
      "Licence": "",
      "Size": [],
      "Annotation": ["none"],
      "Infrastructure": "CLARIN",
      "Access": {
	"Browse": "https://www.sacred-texts.com/neu/ascp/"
	},
      "Publication": ""
}
