{
      "Name": "PS corpus (Post-Scriptum) - ES",
      "URL": "https://hdl.handle.net/21.11129/0000-000D-F918-0",
	"Family": "Historical corpora",
      "Description": "This corpus contains informal mail letters written between the 16th and 19th centuries",
      "Language": ["spa"],
      "Licence": "CC BY-NC-ND",
      "Size": ["2,368 texts"],
      "Annotation": ["PoS tagged", "palaeographically transcribed", "modernised"],
      "Infrastructure": "CLARIN",
      "Access": {
	"Download": "https://hdl.handle.net/21.11129/0000-000D-F918-0"
	},
      "Publication":""
}