{
      "Name": "Plan-V Aphasia Corpus",
      "URL": "https://planv-project.gr/",
	"Family": "Corpora of Disordered Speech",
      "Description": "This corpus contains spoken discourse data collected from Greek-speaking People with Aphasia (PWA) and from neurotypical adults.",
      "Language": ["ell"],
      "Licence": "CC BY 4.0",
      "Size": ["1.84 MB"],
      "Annotation": ["Sentence", "utterance", "clause", "POS"],
      "Infrastructure": "Other", 
      "Access": {
	"Download": "https://inventory.clarin.gr/corpus/1284"
	},
      "Publication": "https://www.zotero.org/groups/562080/clarin/collections/DVZ24JEY/items/C2YVEX3P/"
}
