{
      "Name": "FEUP Tweets",
      "URL": "https://hdl.handle.net/21.11129/0000-000D-F8C1-1",
	"Family": "Computer-mediated communication corpora",
      "Description": "This is a corpus of tweets.\nThe corpus is available from PORTULAN.",
      "Language": ["eng"],
      "Licence": "MS NC-NoReD-ND",
      "Size": ["338 million texts"],
      "Annotation": [""],
      "Infrastructure": "CLARIN",
      "Access": {
	"Download": "https://hdl.handle.net/21.11129/0000-000D-F8C1-1"
	},
      "Publication":""
}