{
  "Name": "SwissSLi",
  "URL": "https://doi.org/10.48656/258r-dj15",
  "Family": "Sign language resources",
  "Description": "The <a href=\"https://www.cl.uzh.ch/en/research-groups/accessibility/resources.html\">SwissSLi</a> corpus is a unique, up to six-way multi-parallel language resource encompassing all three Swiss sign languages and their corresponding spoken languages.\nIt consists of high-quality translation data generated by deaf translators from broadcast television programs, featuring aligned sign language videos and spoken subtitles.\nThe resource supports downstream tasks including sign language machine translation, transcription, and glossing.",
  "Language": [
    "sgg",
    "ssr",
    "slf",
    "deu",
    "fra",
    "ita"
  ],
  "Licence": "CC BY-NC-SA 4.0",
  "Size": [],
  "Annotation": [
    "phrase-segmented",
    "sign-segmented",
    "sentence-segmented"
  ],
  "Infrastructure": "CLARIN",
  "Access": {
    "Download": "https://www.swissubase.ch/en/catalogue/studies/20709/19983/overview"
  },
  "Publication": "https://aclanthology.org/2024.lrec-main.1342/"
}
